,title,abstract
316,"Implementation of an Android Framework for USB storage access without
  root rights","  This bachelor thesis describes the implementation of an Android framework to
access mass storage devices over the USB interface of a smartphone. First the
basics of USB (i.e. interfaces, endpoints and USB On the go) and accessing USB
devices via the official Android API are discussed. Next the USB mass storage
class is explained, which was de- signed by the USB-IF to access mobile mass
storage like USB pen drives or external HDDs. For communication with mass
storage devices, most important are the bulk-only transfer and the SCSI
transparent command set. Furthermore file systems, for accessing directo- ries
and files, are described. This thesis focuses on the FAT32 file system from
Microsoft, because it is the most commonly used file system on such devices.
After the theory part it is time to look at the implementation of the
framework. In this section, the first concern is the purpose in general. Then
the architecture of the framework and the actual implementation are presented.
Important parts are discussed in detail. The thesis finishes with an overview
of the test results on various Android devices, a short conclusion and an
outlook to future developments. Moreover the current status of the developed
framework is visualized.
"
317,"Seamless Resources Sharing in Wearable Networks by Application Function
  Virtualization","  The prevalence of smart wearable devices is increasing exponentially and we
are witnessing a wide variety of fascinating new services that leverage the
capabilities of these wearables. Wearables are truly changing the way mobile
computing is deployed and mobile applications are being developed. It is
possible to leverage the capabilities such as connectivity, processing, and
sensing of wearable devices in an adaptive manner for efficient resource usage
and information accuracy within the personal area network. We show that
application developers are not yet taking advantage of these cross-device
capabilities, however, instead using wearables as passive sensors or simple end
displays to provide notifications to the user. We thus design AFV (Application
Function Virtualization), an architecture enabling automated dynamic function
virtualization and scheduling across devices in a personal area network,
simplifying the development of the apps that are adaptive to context changes.
AFV provides a simple set of APIs hiding complex architectural tasks from app
developers whilst continuously monitoring the user, device and network context,
to enable the adaptive invocation of functions across devices. We show the
feasibility of our design by implementing AFV on Android, and the benefits for
the user in terms of resource efficiency, especially in saving energy
consumption, and quality of experience with multiple use cases.
"
318,EmLog: Tamper-Resistant System Logging for Constrained Devices with TEEs,"  Remote mobile and embedded devices are used to deliver increasingly impactful
services, such as medical rehabilitation and assistive technologies. Secure
system logging is beneficial in these scenarios to aid audit and forensic
investigations particularly if devices bring harm to end-users. Logs should be
tamper-resistant in storage, during execution, and when retrieved by a trusted
remote verifier. In recent years, Trusted Execution Environments (TEEs) have
emerged as the go-to root of trust on constrained devices for isolated
execution of sensitive applications. Existing TEE-based logging systems,
however, focus largely on protecting server-side logs and offer little
protection to constrained source devices. In this paper, we introduce EmLog --
a tamper-resistant logging system for constrained devices using the
GlobalPlatform TEE. EmLog provides protection against complex software
adversaries and offers several additional security properties over past
schemes. The system is evaluated across three log datasets using an
off-the-shelf ARM development board running an open-source,
GlobalPlatform-compliant TEE. On average, EmLog runs with low run-time memory
overhead (1MB heap and stack), 430--625 logs/second throughput, and five-times
persistent storage overhead versus unprotected logs.
"
319,Reservation-Based Federated Scheduling for Parallel Real-Time Tasks,"  This paper considers the scheduling of parallel real-time tasks with
arbitrary-deadlines. Each job of a parallel task is described as a directed
acyclic graph (DAG). In contrast to prior work in this area, where
decomposition-based scheduling algorithms are proposed based on the
DAG-structure and inter-task interference is analyzed as self-suspending
behavior, this paper generalizes the federated scheduling approach. We propose
a reservation-based algorithm, called reservation-based federated scheduling,
that dominates federated scheduling. We provide general constraints for the
design of such systems and prove that reservation-based federated scheduling
has a constant speedup factor with respect to any optimal DAG task scheduler.
Furthermore, the presented algorithm can be used in conjunction with any
scheduler and scheduling analysis suitable for ordinary arbitrary-deadline
sporadic task sets, i.e., without parallelism.
"
320,"Migrate when necessary: toward partitioned reclaiming for soft real-time
  tasks","  This paper presents a new strategy for scheduling soft real-time tasks on
multiple identical cores. The proposed approach is based on partitioned CPU
reservations and it uses a reclaiming mechanism to reduce the number of missed
deadlines. We introduce the possibility for a task to temporarily migrate to
another, less charged, CPU when it has exhausted the reserved bandwidth on its
allocated CPU. In addition, we propose a simple load balancing method to
decrease the number of deadlines missed by the tasks. The proposed algorithm
has been evaluated through simulations, showing its effectiveness (compared to
other multi-core reclaiming approaches) and comparing the performance of
different partitioning heuristics (Best Fit, Worst Fit and First Fit).
"
321,POSIX-based Operating System in the environment of NVM/SCM memory,"  Modern Operating Systems are typically POSIX-compliant. The system calls are
the fundamental layer of interaction between user-space applications and the OS
kernel and its implementation of fundamental abstractions and primitives used
in modern computing. The next generation of NVM/SCM memory raises critical
questions about the efficiency of modern OS architecture. This paper
investigates how the POSIX API drives performance for a system with NVM/SCM
memory. We show that OS and metadata related system calls represent the most
important area of optimization. However, the synchronization related system
calls (poll(), futex(), wait4()) are the most time-consuming overhead that even
a RAMdisk platform fails to eliminate. Attempting to preserve the POSIX-based
approach will likely result in fundamental inefficiencies for any future
applications of NVM/SCM memory.
"
322,Protecting real-time GPU kernels on integrated CPU-GPU SoC platforms,"  Integrated CPU-GPU architecture provides excellent acceleration capabilities
for data parallel applications on embedded platforms while meeting the size,
weight and power (SWaP) requirements. However, sharing of main memory between
CPU applications and GPU kernels can severely affect the execution of GPU
kernels and diminish the performance gain provided by GPU. For example, in the
NVIDIA Tegra K1 platform which has the integrated CPU-GPU architecture, we
noticed that in the worst case scenario, the GPU kernels can suffer as much as
4X slowdown in the presence of co-running memory intensive CPU applications
compared to their solo execution. In this paper, we propose a software
mechanism, which we call BWLOCK++, to protect the performance of GPU kernels
from co-scheduled memory intensive CPU applications.
"
323,"Connecting the World of Embedded Mobiles: The RIOT Approach to
  Ubiquitous Networking for the Internet of Things","  The Internet of Things (IoT) is rapidly evolving based on low-power compliant
protocol standards that extend the Internet into the embedded world. Pioneering
implementations have proven it is feasible to inter-network very constrained
devices, but had to rely on peculiar cross-layered designs and offer a
minimalistic set of features. In the long run, however, professional use and
massive deployment of IoT devices require full-featured, cleanly composed, and
flexible network stacks.
  This paper introduces the networking architecture that turns RIOT into a
powerful IoT system, to enable low-power wireless scenarios. RIOT networking
offers (i) a modular architecture with generic interfaces for plugging in
drivers, protocols, or entire stacks, (ii) support for multiple heterogeneous
interfaces and stacks that can concurrently operate, and (iii) GNRC, its
cleanly layered, recursively composed default network stack. We contribute an
in-depth analysis of the communication performance and resource efficiency of
RIOT, both on a micro-benchmarking level as well as by comparing IoT
communication across different platforms. Our findings show that, though it is
based on significantly different design trade-offs, the networking subsystem of
RIOT achieves a performance equivalent to that of Contiki and TinyOS, the two
operating systems which pioneered IoT software platforms.
"
324,Shai: Enforcing Data-Specific Policies with Near-Zero Runtime Overhead,"  Data retrieval systems such as online search engines and online social
networks must comply with the privacy policies of personal and selectively
shared data items, regulatory policies regarding data retention and censorship,
and the provider's own policies regarding data use. Enforcing these policies is
difficult and error-prone. Systematic techniques to enforce policies are either
limited to type-based policies that apply uniformly to all data of the same
type, or incur significant runtime overhead.
  This paper presents Shai, the first system that systematically enforces
data-specific policies with near-zero overhead in the common case. Shai's key
idea is to push as many policy checks as possible to an offline, ahead-of-time
analysis phase, often relying on predicted values of runtime parameters such as
the state of access control lists or connected users' attributes. Runtime
interception is used sparingly, only to verify these predictions and to make
any remaining policy checks. Our prototype implementation relies on efficient,
modern OS primitives for sandboxing and isolation. We present the design of
Shai and quantify its overheads on an experimental data indexing and search
pipeline based on the popular search engine Apache Lucene.
"
325,Elevating commodity storage with the SALSA host translation layer,"  To satisfy increasing storage demands in both capacity and performance,
industry has turned to multiple storage technologies, including Flash SSDs and
SMR disks. These devices employ a translation layer that conceals the
idiosyncrasies of their mediums and enables random access. Device translation
layers are, however, inherently constrained: resources on the drive are scarce,
they cannot be adapted to application requirements, and lack visibility across
multiple devices. As a result, performance and durability of many storage
devices is severely degraded.
  In this paper, we present SALSA: a translation layer that executes on the
host and allows unmodified applications to better utilize commodity storage.
SALSA supports a wide range of single- and multi-device optimizations and,
because is implemented in software, can adapt to specific workloads. We
describe SALSA's design, and demonstrate its significant benefits using
microbenchmarks and case studies based on three applications: MySQL, the Swift
object store, and a video server.
"
326,vLibOS: Babysitting OS Evolution with a Virtualized Library OS,"  Many applications have service requirements that are not easily met by
existing operating systems. Real-time and security-critical tasks, for example,
often require custom OSes to meet their needs. However, development of special
purpose OSes is a time-consuming and difficult exercise. Drivers, libraries and
applications have to be written from scratch or ported from existing sources.
Many researchers have tackled this problem by developing ways to extend
existing systems with application-specific services. However, it is often
difficult to ensure an adequate degree of separation between legacy and new
services, especially when security and timing requirements are at stake.
Virtualization, for example, supports logical isolation of separate guest
services, but suffers from inadequate temporal isolation of time-critical code
required for real-time systems. This paper presents vLibOS, a master-slave
paradigm for new systems, whose services are built on legacy code that is
temporally and spatially isolated in separate VM domains. Existing OSes are
treated as sandboxed libraries, providing legacy services that are requested by
inter-VM calls, which execute with the time budget of the caller. We evaluate a
real-time implementation of vLibOS. Empirical results show that vLibOS achieves
as much as a 50\% reduction in performance slowdown for real-time threads, when
competing for a shared memory bus with a Linux VM.
"
327,"Mirrored and Hybrid Disk Arrays: Organization, Scheduling, Reliability,
  and Performance","  Basic mirroring (BM) classified as RAID level 1 replicates data on two disks,
thus doubling disk access bandwidth for read requests. RAID1/0 is an array of
BM pairs with balanced loads due to striping. When a disk fails the read load
on its pair is doubled, which results in halving the maximum attainable
bandwidth. We review RAID1 organizations which attain a balanced load upon disk
failure, but as shown by reliability analysis tend to be less reliable than
RAID1/0. Hybrid disk arrays which store XORed instead of replicated data tend
to have a higher reliability than mirrored disks, but incur a higher overhead
in updating data. Read request response time can be improved by processing them
at a higher priority than writes, since they have a direct effect on
application response time. Shortest seek distance and affinity based routing
both shorten seek time. Anticipatory arm placement places arms optimally to
minimize the seek distance. The analysis of RAID1 in normal, degraded, and
rebuild mode is provided to quantify RAID1/0 performance. We compare the
reliability of mirrored disk organizations against each other and hybrid disks
and erasure coded disk arrays.
"
328,Virtual Breakpoints for x86/64,"  Efficient, reliable trapping of execution in a program at the desired
location is a linchpin technique for dynamic malware analysis. The progression
of debuggers and malware is akin to a game of cat and mouse - each are
constantly in a state of trying to thwart one another. At the core of most
efficient debuggers today is a combination of virtual machines and traditional
binary modification breakpoints (int3). In this paper, we present a design for
Virtual Breakpoints. a modification to the x86 MMU which brings breakpoint
management into hardware alongside page tables. In this paper we demonstrate
the fundamental abstraction failures of current trapping methods, and design a
new mechanism from the hardware up. This design incorporates lessons learned
from 50 years of virtualization and debugger design to deliver fast, reliable
trapping without the pitfalls of traditional binary modification.
"
329,Representation Learning for Resource Usage Prediction,"  Creating a model of a computer system that can be used for tasks such as
predicting future resource usage and detecting anomalies is a challenging
problem. Most current systems rely on heuristics and overly simplistic
assumptions about the workloads and system statistics. These heuristics are
typically a one-size-fits-all solution so as to be applicable in a wide range
of applications and systems environments.
  With this paper, we present our ongoing work of integrating systems telemetry
ranging from standard resource usage statistics to kernel and library calls of
applications into a machine learning model. Intuitively, such a ML model
approximates, at any point in time, the state of a system and allows us to
solve tasks such as resource usage prediction and anomaly detection. To achieve
this goal, we leverage readily-available information that does not require any
changes to the applications run on the system. We train recurrent neural
networks to learn a model of the system under consideration. As a proof of
concept, we train models specifically to predict future resource usage of
running applications.
"
330,"Size-aware Sharding For Improving Tail Latencies in In-memory Key-value
  Stores","  This paper introduces the concept of size-aware sharding to improve tail
latencies for in-memory key-value stores, and describes its implementation in
the Minos key-value store. Tail latencies are crucial in distributed
applications with high fan-out ratios, because overall response time is
determined by the slowest response. Size-aware sharding distributes requests
for keys to cores according to the size of the item associated with the key. In
particular, requests for small and large items are sent to disjoint subsets of
cores. Size-aware sharding improves tail latencies by avoiding head-of-line
blocking, in which a request for a small item gets queued behind a request for
a large item. Alternative size-unaware approaches to sharding, such as
keyhash-based sharding, request dispatching and stealing do not avoid
head-of-line blocking, and therefore exhibit worse tail latencies. The
challenge in implementing size-aware sharding is to maintain high throughput by
avoiding the cost of software dispatching and by achieving load balancing
between different cores. Minos uses hardware dispatch for all requests for
small items, which form the very large majority of all requests. It achieves
load balancing by adapting the number of cores handling requests for small and
large items to their relative presence in the workload. We compare Minos to
three state-of-the-art designs of in-memory KV stores. Compared to its closest
competitor, Minos achieves a 99th percentile latency that is up to two orders
of magnitude lower. Put differently, for a given value for the 99th percentile
latency equal to 10 times the mean service time, Minos achieves a throughput
that is up to 7.4 times higher.
"
331,Realizing Uncertainty-Aware Timing Stack in Embedded Operating System,"  Time awareness is critical to a broad range of emerging applications -- in
Cyber-Physical Systems and Internet of Things -- running on commodity platforms
and operating systems. Traditionally, time is synchronized across devices
through a best-effort background service whose performance is neither
observable nor controllable, thus consuming system resources independently of
application needs while not allowing the applications and OS services to adapt
to changes in uncertainty in system time. We advocate for rethinking how time
is managed in a system stack. In this paper, we propose a new clock model that
characterizes various sources of timing uncertainties in true time. We then
present a Kalman filter based time synchronization protocol that adapts to the
uncertainties exposed by the clock model. Our realization of a
uncertainty-aware clock model and synchronization protocol is based on a
standard embedded Linux platform.
"
332,End-to-end Analysis and Design of a Drone Flight Controller,"  Timing guarantees are crucial to cyber-physical applications that must bound
the end-to-end delay between sensing, processing and actuation. For example, in
a flight controller for a multirotor drone, the data from a gyro or inertial
sensor must be gathered and processed to determine the attitude of the
aircraft. Sensor data fusion is followed by control decisions that adjust the
flight of a drone by altering motor speeds. If the processing pipeline between
sensor input and actuation is not bounded, the drone will lose control and
possibly fail to maintain flight.
  Motivated by the implementation of a multithreaded drone flight controller on
the Quest RTOS, we develop a composable pipe model based on the system's task,
scheduling and communication abstractions. This pipe model is used to analyze
two semantics of end-to-end time: reaction time and freshness time. We also
argue that end-to-end timing properties should be factored in at the early
stage of application design. Thus, we provide a mathematical framework to
derive feasible task periods that satisfy both a given set of end-to-end timing
constraints and the schedulability requirement. We demonstrate the
applicability of our design approach by using it to port the Cleanflight flight
controller firmware to Quest on the Intel Aero board. Experiments show that
Cleanflight ported to Quest is able to achieve end-to-end latencies within the
predicted time bounds derived by analysis.
"
333,"KASR: A Reliable and Practical Approach to Attack Surface Reduction of
  Commodity OS Kernels","  Commodity OS kernels have broad attack surfaces due to the large code base
and the numerous features such as device drivers. For a real-world use case
(e.g., an Apache Server), many kernel services are unused and only a small
amount of kernel code is used. Within the used code, a certain part is invoked
only at runtime while the rest are executed at startup and/or shutdown phases
in the kernel's lifetime run. In this paper, we propose a reliable and
practical system, named KASR, which transparently reduces attack surfaces of
commodity OS kernels at runtime without requiring their source code. The KASR
system, residing in a trusted hypervisor, achieves the attack surface reduction
through a two-step approach: (1) reliably depriving unused code of executable
permissions, and (2) transparently segmenting used code and selectively
activating them. We implement a prototype of KASR on Xen-4.8.2 hypervisor and
evaluate its security effectiveness on Linux kernel-4.4.0-87-generic. Our
evaluation shows that KASR reduces the kernel attack surface by 64% and trims
off 40% of CVE vulnerabilities. Besides, KASR successfully detects and blocks
all 6 real-world kernel rootkits. We measure its performance overhead with
three benchmark tools (i.e., SPECINT, httperf and bonnie++). The experimental
results indicate that KASR imposes less than 1% performance overhead (compared
to an unmodified Xen hypervisor) on all the benchmarks.
"
334,"Push Forward: Global Fixed-Priority Scheduling of Arbitrary-Deadline
  Sporadic Task Systems","  The sporadic task model is often used to analyze recurrent execution of
identical tasks in real-time systems. A sporadic task defines an infinite
sequence of task instances, also called jobs, that arrive under the minimum
inter-arrival time constraint. To ensure the system safety, timeliness has to
be guaranteed in addition to functional correctness, i.e., all jobs of all
tasks have to be finished before the job deadlines. We focus on analyzing
arbitrary-deadline task sets on a homogeneous (identical) multiprocessor system
under any given global fixed-priority scheduling approach and provide a series
of schedulability tests with different tradeoffs between their time complexity
and their accuracy. Under the arbitrary-deadline setting, the relative deadline
of a task can be longer than the minimum inter-arrival time of the jobs of the
task. We show that global deadline-monotonic (DM) scheduling has a speedup
bound of $3-1/M$ against any optimal scheduling algorithms, where $M$ is the
number of identical processors, and prove that this bound is asymptotically
tight.
"
335,The Secure Machine: Efficient Secure Execution On Untrusted Platforms,"  In this work we present the Secure Machine, SeM for short, a CPU architecture
extension for secure computing. SeM uses a small amount of in-chip additional
hardware that monitors key communication channels inside the CPU chip, and only
acts when required. SeM provides confidentiality and integrity for a secure
program without trusting the platform software or any off-chip hardware. SeM
supports existing binaries of single- and multi-threaded applications running
on single- or multi-core, multi-CPU. The performance reduction caused by it is
only few percent, most of which is due to the memory encryption layer that is
commonly used in many secure architectures.
  We also developed SeM-Prepare, a software tool that automatically instruments
existing applications (binaries) with additional instructions so they can be
securely executed on our architecture without requiring any programming efforts
or the availability of the desired program`s source code.
  To enable secure data sharing in shared memory environments, we developed
Secure Distributed Shared Memory (SDSM), an efficient (time and memory)
algorithm for allowing thousands of compute nodes to share data securely while
running on an untrusted computing environment. SDSM shows a negligible
reduction in performance, and it requires negligible and hardware resources. We
developed Distributed Memory Integrity Trees, a method for enhancing single
node integrity trees for preserving the integrity of a distributed application
running on an untrusted computing environment. We show that our method is
applicable to existing single node integrity trees such as Merkle Tree, Bonsai
Merkle Tree, and Intel`s SGX memory integrity engine. All these building blocks
may be used together to form a practical secure system, and some can be used in
conjunction with other secure systems.
"
