,title,abstract
167,Transparent Checkpoint-Restart over InfiniBand,"  InfiniBand is widely used for low-latency, high-throughput cluster computing.
Saving the state of the InfiniBand network as part of distributed checkpointing
has been a long-standing challenge for researchers. Because of a lack of a
solution, typical MPI implementations have included custom checkpoint-restart
services that ""tear down"" the network, checkpoint each node as if the node were
a standalone computer, and then re-connect the network again. We present the
first example of transparent, system-initiated checkpoint-restart that directly
supports InfiniBand. The new approach is independent of any particular Linux
kernel, thus simplifying the current practice of using a kernel-based module,
such as BLCR. This direct approach results in checkpoints that are found to be
faster than with the use of a checkpoint-restart service. The generality of
this approach is shown not only by checkpointing an MPI computation, but also a
native UPC computation (Berkeley Unified Parallel C), which does not use MPI.
Scalability is shown by checkpointing 2,048 MPI processes across 128 nodes
(with 16 cores per node). In addition, a cost-effective debugging approach is
also enabled, in which a checkpoint image from an InfiniBand-based production
cluster is copied to a local Ethernet-based cluster, where it can be restarted
and an interactive debugger can be attached to it. This work is based on a
plugin that extends the DMTCP (Distributed MultiThreaded CheckPointing)
checkpoint-restart package.
"
168,"Cache-aware static scheduling for hard real-time multicore systems based
  on communication affinities","  The growing need for continuous processing capabilities has led to the
development of multicore systems with a complex cache hierarchy. Such multicore
systems are generally designed for improving the performance in average case,
while hard real-time systems must consider worst-case scenarios. An open
challenge is therefore to efficiently schedule hard real-time tasks on a
multicore architecture. In this work, we propose a mathematical formulation for
computing a static scheduling that minimize L1 data cache misses between hard
real-time tasks on a multicore architecture using communication affinities.
"
169,Rio: A System Solution for Sharing I/O between Mobile Systems,"  Mobile systems are equipped with a diverse collection of I/O devices,
including cameras, microphones, sensors, and modems. There exist many novel use
cases for allowing an application on one mobile system to utilize I/O devices
from another. This paper presents Rio, an I/O sharing solution that supports
unmodified applications and exposes all the functionality of an I/O device for
sharing. Rio's design is common to many classes of I/O devices, thus
significantly reducing the engineering effort to support new I/O devices. Our
implementation of Rio on Android consists of 6700 total lines of code and
supports four I/O classes with fewer than 450 class-specific lines of code. Rio
also supports I/O sharing between mobile systems of different form factors,
including smartphones and tablets. We show that Rio achieves performance close
to that of local I/O for audio, sensors, and modems, but suffers noticeable
performance degradation for camera due to network throughput limitations
between the two systems, which is likely to be alleviated by emerging wireless
standards.
"
170,Support for Error Tolerance in the Real-Time Transport Protocol,"  Streaming applications often tolerate bit errors in their received data well.
This is contrasted by the enforcement of correctness of the packet headers and
payload by network protocols. We investigate a solution for the Real-time
Transport Protocol (RTP) that is tolerant to errors by accepting erroneous
data. It passes potentially corrupted stream data payloads to the codecs. If
errors occur in the header, our solution recovers from these by leveraging the
known state and expected header values for each stream. The solution is fully
receiver-based and incrementally deployable, and as such requires neither
support from the sender nor changes to the RTP specification. Evaluations show
that our header error recovery scheme can recover from almost all errors, with
virtually no erroneous recoveries, up to bit error rates of about 10%.
"
171,Transparent Checkpoint-Restart for Hardware-Accelerated 3D Graphics,"  Providing fault-tolerance for long-running GPU-intensive jobs requires
application-specific solutions, and often involves saving the state of complex
data structures spread among many graphics libraries. This work describes a
mechanism for transparent GPU-independent checkpoint-restart of 3D graphics.
The approach is based on a record-prune-replay paradigm: all OpenGL calls
relevant to the graphics driver state are recorded; calls not relevant to the
internal driver state as of the last graphics frame prior to checkpoint are
discarded; and the remaining calls are replayed on restart. A previous approach
for OpenGL 1.5, based on a shadow device driver, required more than 78,000
lines of OpenGL-specific code. In contrast, the new approach, based on
record-prune-replay, is used to implement the same case in just 4,500 lines of
code. The speed of this approach varies between 80 per cent and nearly 100 per
cent of the speed of the native hardware acceleration for OpenGL 1.5, as
measured when running the ioquake3 game under Linux. This approach has also
been extended to demonstrate checkpointing of OpenGL 3.0 for the first time,
with a demonstration for PyMol, for molecular visualization.
"
172,"Performance Impact of Lock-Free Algorithms on Multicore Communication
  APIs","  Data race conditions in multi-tasking software applications are prevented by
serializing access to shared memory resources, ensuring data consistency and
deterministic behavior. Traditionally tasks acquire and release locks to
synchronize operations on shared memory. Unfortunately, lock management can add
significant processing overhead especially for multicore deployments where
tasks on different cores convoy in queues waiting to acquire a lock.
Implementing more than one lock introduces the risk of deadlock and using
spinlocks constrains which cores a task can run on. The better alternative is
to eliminate locks and validate that real-time properties are met, which is not
directly considered in many embedded applications. Removing the locks is
non-trivial and packaging lock-free algorithms for developers reduces the
possibility of concurrency defects. This paper details how a multicore
communication API implementation is enhanced to support lock-free messaging and
the impact this has on data exchange latency between tasks. Throughput and
latency are compared on Windows and Linux between lock-based and lock-free
implementations for data exchange of messages, packets, and scalars. A model of
the lock-free exchange predicts performance at the system architecture level
and provides a stop criterion for the refactoring. The results show that
migration from single to multicore hardware architectures degrades lock-based
performance, and increases lock-free performance.
"
173,Anception: Application Virtualization For Android,"  The problem of malware has become significant on Android devices. Library
operating systems and application virtualization are both possible solutions
for confining malware. Unfortunately, such solutions do not exist for Android.
Designing mechanisms for application virtualization is a significant chal-
lenge for several reasons: (1) graphics performance is important due to
popularity of games and (2) applications with the same UID can share state.
This paper presents Anception, the first flexible application virtualization
framework for Android. It is imple- mented as a modification to the Android
kernel and supports application virtualization that addresses the above
requirements. Anception is able to confine many types of malware while
supporting unmodified Android applications. Our Anception- based system
exhibits up to 3.9% overhead on various 2D/3D benchmarks, and 1.8% overhead on
the SunSpider benchmark.
"
174,"LWRP: Low Power Consumption Weighting Replacement Policy using Buffer
  Memory","  As the performance gap between memory and processors has increased, then it
leads to the poor performance. Efficient virtual memory can overcome this
problem. And the efficiency of virtual memory depends on the replacement policy
used for cache. In this paper, our algorithm not only based on the time to last
access and frequency index but, we also consider the power consumption. We show
that Low Power Consumption Weighting Replacement Policy (LWRP) has better
performance and low power consumption.
"
175,Formal Description of Components in Operating Systems,"  The contemporary development of hardware components is a prerequisite for
increasing the concentration of computing power. System software is developing
at a much slower pace. To use available resources efficiently modeling is
required. Formalization of elements, present in the material, provides the
basis for modeling. Examples are presented to demonstrate the efficiency of the
concept.
"
176,"Design and Performance Evaluation of an Optimized Disk Scheduling
  Algorithm (ODSA)","  Management of disk scheduling is a very important aspect of operating system.
Performance of the disk scheduling completely depends on how efficient is the
scheduling algorithm to allocate services to the request in a better manner.
Many algorithms (FIFO, SSTF, SCAN, C-SCAN, LOOK, etc.) are developed in the
recent years in order to optimize the system disk I/O performance. By reducing
the average seek time and transfer time, we can improve the performance of disk
I/O operation. In our proposed algorithm, Optimize Disk Scheduling Algorithm
(ODSA) is taking less average seek time and transfer time as compare to other
disk scheduling algorithms (FIFO, SSTF, SCAN, C-SCAN, LOOK, etc.), which
enhances the efficiency of the disk performance in a better manner.
"
177,"A Group based Time Quantum Round Robin Algorithm using Min-Max Spread
  Measure","  Round Robin (RR) Scheduling is the basis of time sharing environment. It is
the combination of First Come First Served (FCFS) scheduling algorithm and
preemption among processes. It is basically used in a time sharing operating
system. It switches from one process to another process in a time interval. The
time interval or Time Quantum (TQ) is fixed for all available processes. So,
the larger process suffers from Context Switches (CS). To increase efficiency,
we have to select different TQ for processes. The main objective of RR is to
reduce the CS, maximize the utilization of CPU and minimize the turn around and
the waiting time. In this paper, we have considered different TQ for a group of
processes. It reduces CS as well as enhancing the performance of RR algorithm.
TQ can be calculated using min-max dispersion measure. Our experimental
analysis shows that Group Based Time Quantum (GBTQ) RR algorithm performs
better than existing RR algorithm with respect to Average Turn Around Time
(ATAT), Average Waiting Time (AWT) and CS.
"
178,"A Taxonomy for Attack Patterns on Information Flows in Component-Based
  Operating Systems","  We present a taxonomy and an algebra for attack patterns on component-based
operating systems. In a multilevel security scenario, where isolation of
partitions containing data at different security classifications is the primary
security goal and security breaches are mainly defined as undesired disclosure
or modification of classified data, strict control of information flows is the
ultimate goal. In order to prevent undesired information flows, we provide a
classification of information flow types in a component-based operating system
and, by this, possible patterns to attack the system. The systematic
consideration of informations flows reveals a specific type of operating system
covert channel, the covert physical channel, which connects two former isolated
partitions by emitting physical signals into the computer's environment and
receiving them at another interface.
"
179,"Task & Resource Self-adaptive Embedded Real-time Operating System
  Microkernel for Wireless Sensor Nodes","  Wireless Sensor Networks (WSNs) are used in many application fields, such as
military, healthcare, environment surveillance, etc. The WSN OS based on
event-driven model doesn't support real-time and multi-task application types
and the OSs based on thread-driven model consume much energy because of
frequent context switch. Due to the high-dense and large-scale deployment of
sensor nodes, it is very difficult to collect sensor nodes to update their
software. Furthermore, the sensor nodes are vulnerable to security attacks
because of the characteristics of broadcast communication and unattended
application. This paper presents a task and resource self-adaptive embedded
real-time microkernel, which proposes hybrid programming model and offers a
two-level scheduling strategy to support real-time multi-task correspondingly.
A communication scheme, which takes the ""tuple"" space and ""IN/OUT"" primitives
from ""LINDA"", is proposed to support some collaborative and distributed tasks.
In addition, this kernel implements a run-time over-the-air updating mechanism
and provides a security policy to avoid the attacks and ensure the reliable
operation of nodes. The performance evaluation is proposed and the experiential
results show this kernel is task-oriented and resource-aware and can be used
for the applications of event-driven and real-time multi-task.
"
180,File System Design Approaches,"  In this article, the file system development design approaches are discussed.
The selection of the file system design approach is done according to the needs
of the developers what are the needed requirements and specifications for the
new design. It allowed us to identify where our proposal fitted in with
relation to current and past file system development. Our experience with file
system development is limited so the research served to identify the different
techniques that can be used. The variety of file systems encountered show what
an active area of research file system development is. The file systems may be
from one of the two fundamental categories. In one category, the file system is
developed in user space and runs as a user process. Another file system may be
developed in the kernel space and runs as a privileged process. Another one is
the mixed approach in which we can take the advantages of both aforesaid
approaches. Each development option has its own pros and cons. In this article,
these design approaches are discussed.
"
181,Toward Parametric Timed Interfaces for Real-Time Components,"  We propose here a framework to model real-time components consisting of
concurrent real-time tasks running on a single processor, using parametric
timed automata. Our framework is generic and modular, so as to be easily
adapted to different schedulers and more complex task models. We first perform
a parametric schedulability analysis of the components using the inverse
method. We show that the method unfortunately does not provide satisfactory
results when the task periods are consid- ered as parameters. After identifying
and explaining the problem, we present a solution adapting the model by making
use of the worst-case scenario in schedulability analysis. We show that the
analysis with the inverse method always converges on the modified model when
the system load is strictly less than 100%. Finally, we show how to use our
parametric analysis for the generation of timed interfaces in compositional
system design.
"
182,"An Enhanced Multi-Pager Environment Support for Second Generation
  Microkernels","  The main objective of this paper is to present a mechanism of enhanced paging
support for the second generation microkernels in the form of explicit support
of multi-pager environment for the tasks running in the system. Proposed
mechanism is based on the intra-kernel high granularity pagers assignments per
virtual address space, which allow efficient and simple dispatching of page
faults to the appropriate pagers. The paging is one of the major features of
the virtual memory, which is extensively used by advanced operating systems to
provide an illusion of elastic memory. Original and present second generation
microkernels provide only limited, inflexible and unnatural support for paging.
Furthermore, facilities provided by current solutions for multi-pager support
on the runtime level introduce an overhead in terms of mode switches and thread
context switches which can be significantly reduced. Limited paging support
limits the attractiveness of the second generation microkernel based systems
use in real-life applications, in which processes usually have concurrent
servicing of multiple paging servers. The purpose of this paper is to present a
facilities for the efficient and flexible support of multi-pager environments
for the second generation microkernels. A comparison of the proposed solution
to the present architecture L4 + L4Re has been made and overhead of the page
fault handling critical path has been evaluated. Proposed solution is simple
enough and provides a natural and flexible support of multi-pager environments
for second generation microkernels in efficient way. It introduces a third less
overhead in terms of the mode switches and thread context switches in
comparison to the present L4 + L4Re solution implemented in the Fiasco.OC.
"
183,An Effective Round Robin Algorithm using Min-Max Dispersion Measure,"  Round Robin (RR) scheduling algorithm is a preemptive scheduling algorithm.
It is designed especially for time sharing Operating System (OS). In RR
scheduling algorithm the CPU switches between the processes when the static
Time Quantum (TQ) expires. RR scheduling algorithm is considered as the most
widely used scheduling algorithm in research because the TQ is equally shared
among the processes. In this paper a newly proposed variant of RR algorithm
called Min-Max Round Robin (MMRR) scheduling algorithm is presented. The idea
of this MMRR is to make the TQ repeatedly adjusted using Min-Max dispersion
measure in accordance with remaining CPU burst time. Our experimental analysis
shows that MMRR performs much better than RR algorithm in terms of average
turnaround time, average waiting time and number of context switches.
"
184,"Enhancing CPU Performance using Subcontrary Mean Dynamic Round Robin
  (SMDRR) Scheduling Algorithm","  Round Robin (RR) Algorithm is considered as optimal in time shared
environment because the static time is equally shared among the processes. If
the time quantum taken is static then it undergoes degradation of the CPU
performance and leads to so many context switches. In this paper, we have
proposed a new effective dynamic RR algorithm SMDRR (Subcontrary Mean Dynamic
Round Robin) based on dynamic time quantum where we use the subcontrary mean or
harmonic mean to find the time quantum. The idea of this approach is to make
the time quantum repeatedly adjusted according to the burst time of the
currently running processes. Our experimental analysis shows that SMDRR
performs better than RR algorithm in terms of reducing the number of context
switches, average turnaround time and average waiting time.
"
185,"Proceedings of the First Workshop on Resource Awareness and Adaptivity
  in Multi-Core Computing (Racing 2014)","  This volume contains the papers accepted at the 1st Workshop on Resource
Awareness and Adaptivity in Multi-Core Computing (Racing 2014), held in
Paderborn, Germany, May 29-30, 2014. Racing 2014 was co-located with the IEEE
European Test Symposium (ETS).
"
186,"Heterogeneity-aware Fault Tolerance using a Self-Organizing Runtime
  System","  Due to the diversity and implicit redundancy in terms of processing units and
compute kernels, off-the-shelf heterogeneous systems offer the opportunity to
detect and tolerate faults during task execution in hardware as well as in
software. To automatically leverage this diversity, we introduce an extension
of an online-learning runtime system that combines the benefits of the existing
performance-oriented task mapping with task duplication, a diversity-oriented
mapping strategy and heterogeneity-aware majority voter. This extension uses a
new metric to dynamically rate the remaining benefit of unreliable processing
units and a memory management mechanism for automatic data transfers and
checkpointing in the host and device memories.
"
187,"Resource-Aware Replication on Heterogeneous Multicores: Challenges and
  Opportunities","  Decreasing hardware feature sizes and increasing heterogeneity in multicore
hardware require software that can adapt to these platforms' properties. We
implemented ROMAIN, an OS service providing redundant multithreading on top of
the FIASCO.OC microkernel to address the increasing unreliability of hardware.
In this paper we review challenges and opportunities for ROMAIN to adapt to
such multicore platforms in order to decrease execution overhead, resource
requirements, and vulnerability against faults.
"
188,Hello rootKitty: A lightweight invariance-enforcing framework,"  In monolithic operating systems, the kernel is the piece of code that
executes with the highest privileges and has control over all the software
running on a host. A successful attack against an operating system's kernel
means a total and complete compromise of the running system. These attacks
usually end with the installation of a rootkit, a stealthy piece of software
running with kernel privileges. When a rootkit is present, no guarantees can be
made about the correctness, privacy or isolation of the operating system.
  In this paper we present \emph{Hello rootKitty}, an invariance-enforcing
framework which takes advantage of current virtualization technology to protect
a guest operating system against rootkits. \emph{Hello rootKitty} uses the idea
of invariance to detect maliciously modified kernel data structures and restore
them to their original legitimate values. Our prototype has negligible
performance and memory overhead while effectively protecting commodity
operating systems from modern rootkits.
"
189,"Supporting Soft Real-Time Sporadic Task Systems on Heterogeneous
  Multiprocessors with No Utilization Loss","  Heterogeneous multicore architectures are becoming increasingly popular due
to their potential of achieving high performance and energy efficiency compared
to the homogeneous multicore architectures. In such systems, the real-time
scheduling problem becomes more challenging in that processors have different
speeds. A job executing on a processor with speed $x$ for $t$ time units
completes $(x \cdot t)$ units of execution. Prior research on heterogeneous
multiprocessor real-time scheduling has focused on hard real-time systems,
where, significant processing capacity may have to be sacrificed in the
worst-case to ensure that all deadlines are met. As meeting hard deadlines is
overkill for many soft real-time systems in practice, this paper shows that on
soft real-time heterogeneous multiprocessors, bounded response times can be
ensured for globally-scheduled sporadic task systems with no utilization loss.
A GEDF-based scheduling algorithm, namely GEDF-H, is presented and response
time bounds are established under both preemptive and non-preemptive GEDF-H
scheduling. Extensive experiments show that the magnitude of the derived
response time bound is reasonable, often smaller than three task periods. To
the best of our knowledge, this paper is the first to show that soft real-time
sporadic task systems can be supported on heterogeneous multiprocessors without
utilization loss, and with reasonable predicted response time.
"
190,Timing Analysis for DAG-based and GFP Scheduled Tasks,"  Modern embedded systems have made the transition from single-core to
multi-core architectures, providing performance improvement via parallelism
rather than higher clock frequencies. DAGs are considered among the most
generic task models in the real-time domain and are well suited to exploit this
parallelism. In this paper we provide a schedulability test using response-time
analysis exploiting exploring and bounding the self interference of a DAG task.
Additionally we bound the interference a high priority task has on lower
priority ones.
"
